{
  "version": "1",
  "title": "Glutes, Calves & Core Hypertrophy",
  "date": "2025-11-13",
  "block": 5,
  "week": 2,
  "notes": "Block 5 Week 2: Progressive overload from Week 1. Hip thrust stable at 60 lb (RPE 7), add reps. Goblet squat 60 lb good for 10,10,8 - target 12,10,10. RDL at 60×2 (RPE 8) - maintain or add reps. Split squat 40×2 solid. Added single-leg calf raise during cooldown for additional calf volume. Estimated time: 32 minutes (working sets + rest, excludes warm-up/cooldown).",
  "sections": [
    {
      "type": "Warm-up",
      "title": "Lower Body Prep",
      "items": [
        { "kind": "exercise", "name": "Bodyweight Squat", "link": "exercises/bodyweight_squat.json", "logType": "mobility", "prescription": { "sets": 1, "reps": 10 } },
        { "kind": "exercise", "name": "Hip Circles", "link": "exercises/hip_circles.json", "logType": "mobility", "prescription": { "sets": 1, "reps": "10 each direction" } },
        { "kind": "exercise", "name": "Leg Swings", "link": "exercises/leg_swings.json", "logType": "mobility", "prescription": { "sets": 1, "reps": "10 each leg" } },
        { "kind": "exercise", "name": "Glute Bridge", "link": "exercises/glute_bridge.json", "logType": "mobility", "prescription": { "sets": 1, "reps": 10 } }
      ]
    },
    {
      "type": "Strength",
      "title": "Primary Glute Work - Superset A",
      "items": [
        {
          "kind": "superset",
          "name": "Superset A",
          "notes": "Perform both exercises back-to-back, then rest 90s before next round",
          "children": [
            {
              "kind": "exercise",
              "name": "Dumbbell Hip Thrust",
              "link": "exercises/dumbbell_hip_thrust.json",
              "logType": "strength",
              "prescription": { "sets": 3, "reps": "12-15", "weight": 60, "rpe": 7 },
              "cues": ["Squeeze glutes at top", "Ribs down", "Full hip extension"],
              "notes": "Week 1: 12,12,12 @ 60 lb, RPE 7 (all rounds). Week 2: Target 15,12,12 OR progress to 65 lb."
            },
            {
              "kind": "exercise",
              "name": "Goblet Squat",
              "link": "exercises/goblet_squat.json",
              "logType": "strength",
              "prescription": { "sets": 3, "reps": "10-12", "weight": 60, "restSeconds": 90, "rpe": 7.5 },
              "cues": ["Chest tall", "Elbows down", "Knees track over toes"],
              "notes": "Week 1: 10,10,8 @ 60 lb, RPE 7-7.5. Week 2: Target 12,10,10."
            }
          ]
        }
      ]
    },
    {
      "type": "Strength",
      "title": "Secondary Glute & Hamstring - Superset B",
      "items": [
        {
          "kind": "superset",
          "name": "Superset B",
          "notes": "Perform both exercises back-to-back, then rest 90s before next round",
          "children": [
            {
              "kind": "exercise",
              "name": "Bulgarian Split Squat",
              "link": "exercises/bulgarian_split_squat.json",
              "logType": "strength",
              "prescription": { "sets": 3, "reps": "10-12 per leg", "weight": "40 x2", "rpe": 7.5 },
              "cues": ["Upright torso", "Front heel planted", "Control descent"],
              "notes": "Week 1: 12,10,10 per leg @ 40×2, RPE 7-8. Week 2: Target 12,12,10."
            },
            {
              "kind": "exercise",
              "name": "Dumbbell RDL",
              "link": "exercises/dumbbell_rdl.json",
              "logType": "strength",
              "prescription": { "sets": 3, "reps": "10-12", "weight": "60 x2", "restSeconds": 90, "rpe": 8 },
              "cues": ["Hinge at hips", "Soft knee", "Chest up"],
              "notes": "Week 1: 10,10,8 @ 60×2, RPE 8 (all rounds). Week 2: Maintain 10,10,10 OR add 1 rep if RPE <8."
            }
          ]
        }
      ]
    },
    {
      "type": "Accessory/Core",
      "title": "Calves & Core - Superset C",
      "items": [
        {
          "kind": "superset",
          "name": "Superset C",
          "notes": "Perform both exercises back-to-back, then rest 60s before next round",
          "children": [
            {
              "kind": "exercise",
              "name": "Standing Calf Raise",
              "link": "exercises/standing_calf_raise.json",
              "logType": "strength",
              "prescription": { "sets": 3, "reps": "12-15", "weight": "30 x2", "rpe": 7 },
              "cues": ["Full range", "Pause at top", "Control descent"],
              "notes": "Week 1: 12,12,12 @ 30×2, RPE 7. Week 2: Target 15,12,12 OR add load."
            },
            {
              "kind": "exercise",
              "name": "Pallof Press Hold",
              "link": "exercises/pallof_press.json",
              "logType": "strength",
              "prescription": { "sets": 3, "reps": "6-8 each side", "holdSeconds": 25, "restSeconds": 60, "rpe": 7 },
              "notes": "Week 1: 6,6 each side @ RPE 7 (only 2 rounds logged). Week 2: Complete 3 rounds, 6-8 per side.",
              "cues": ["Resist rotation", "Breathe steady", "Ribs down"]
            }
          ]
        }
      ]
    },
    {
      "type": "Cooldown/Recovery",
      "title": "Cooldown & Stretch",
      "items": [
        { "kind": "exercise", "name": "Single-Leg Calf Raise", "link": "exercises/single_leg_calf_raise.json", "logType": "strength", "prescription": { "sets": 2, "reps": "12-15 per leg", "restSeconds": 45, "rpe": 7 }, "notes": "Week 2 addition: Unilateral calf work for balance + volume. Bodyweight or hold light DB for stability." },
        { "kind": "exercise", "name": "Hip Flexor Stretch", "link": "exercises/hip_flexor_stretch.json", "logType": "stretch", "prescription": { "holdSeconds": 60 }, "notes": "Hold 60s per side" },
        { "kind": "exercise", "name": "Seated Hamstring Stretch", "link": "exercises/seated_hamstring_stretch.json", "logType": "stretch", "prescription": { "holdSeconds": 60 }, "notes": "Hold 60s per leg" },
        { "kind": "exercise", "name": "Figure-4 Glute Stretch", "link": "exercises/figure_4_glute_stretch.json", "logType": "stretch", "prescription": { "holdSeconds": 60 }, "notes": "Hold 60s per side" },
        { "kind": "exercise", "name": "Child's Pose", "link": "exercises/childs_pose.json", "logType": "stretch", "prescription": { "holdSeconds": 90 } }
      ]
    }
  ]
}
