{
  "version": "1",
  "title": "Lower Body Strength Mobility",
  "date": "2024-10-24",
  "block": 4,
  "week": 3,
  "sections": [
    {
      "type": "Warm-up",
      "title": "Lower Body Activation",
      "items": [
        {
          "kind": "exercise",
          "name": "Leg Swings",
          "link": "exercises/leg_swings.json",
          "logType": "mobility",
          "prescription": {
            "sets": 1,
            "reps": "10 each leg/direction"
          },
          "notes": "Front-to-back and side-to-side"
        },
        {
          "kind": "exercise",
          "name": "Bodyweight Squat",
          "link": "exercises/bodyweight_squat.json",
          "logType": "mobility",
          "prescription": {
            "sets": 2,
            "reps": 10
          },
          "notes": "Full depth, pause 2s at bottom"
        },
        {
          "kind": "exercise",
          "name": "Glute Bridge",
          "link": "exercises/glute_bridge.json",
          "logType": "mobility",
          "prescription": {
            "sets": 2,
            "reps": 12
          },
          "notes": "2s pause at top, activate glutes"
        },
        {
          "kind": "exercise",
          "name": "Clamshells",
          "link": "exercises/clamshells.json",
          "logType": "mobility",
          "prescription": {
            "sets": 2,
            "reps": 10
          },
          "notes": "Each side, hip stability activation"
        }
      ]
    },
    {
      "type": "Strength",
      "title": "Primary Lower Body",
      "items": [
        {
          "kind": "exercise",
          "name": "Goblet Squat",
          "link": "exercises/goblet_squat.json",
          "logType": "strength",
          "prescription": {
            "sets": 4,
            "reps": 8,
            "weight": "67.5 lb",
            "rpe": 7.5,
            "restSeconds": 150
          },
          "notes": "Progressive from 65 lb. Focus on depth and control"
        },
        {
          "kind": "exercise",
          "name": "Dumbbell Romanian Deadlift",
          "link": "exercises/dumbbell_romanian_deadlift.json",
          "logType": "strength",
          "prescription": {
            "sets": 4,
            "reps": 8,
            "weight": "67.5 x2 lb",
            "rpe": 7.5,
            "restSeconds": 150
          },
          "notes": "Progressive from 65 x2 lb. Emphasize hip hinge pattern"
        },
        {
          "kind": "exercise",
          "name": "Bulgarian Split Squat",
          "link": "exercises/bulgarian_split_squat.json",
          "logType": "strength",
          "prescription": {
            "sets": 3,
            "reps": 8,
            "weight": "47.5 x2 lb",
            "rpe": 7.5,
            "restSeconds": 120
          },
          "notes": "Progressive from 45 x2 lb. Each leg, focus on front leg loading"
        },
        {
          "kind": "exercise",
          "name": "Standing Calf Raise",
          "link": "exercises/standing_calf_raise.json",
          "logType": "strength",
          "prescription": {
            "sets": 3,
            "reps": 15,
            "weight": "37.5 x2 lb",
            "rpe": 7.5,
            "restSeconds": 90
          },
          "notes": "Progressive from 35 x2 lb. Important for basketball jumping"
        }
      ]
    },
    {
      "type": "Accessory/Core",
      "title": "Unilateral & Core",
      "items": [
        {
          "kind": "exercise",
          "name": "Lateral Lunges",
          "link": "exercises/lateral_lunges.json",
          "logType": "strength",
          "prescription": {
            "sets": 3,
            "reps": 10,
            "weight": "25 lb",
            "rpe": 7,
            "restSeconds": 75
          },
          "notes": "Each side, basketball-specific movement pattern"
        },
        {
          "kind": "exercise",
          "name": "Single-Leg Deadlift",
          "link": "exercises/single_leg_deadlift.json",
          "logType": "strength",
          "prescription": {
            "sets": 3,
            "reps": 8,
            "weight": "30 lb",
            "rpe": 7,
            "restSeconds": 75
          },
          "notes": "Each leg, balance and stability challenge"
        },
        {
          "kind": "exercise",
          "name": "Loaded March",
          "link": "exercises/loaded_march.json",
          "logType": "strength",
          "prescription": {
            "sets": 3,
            "reps": 10,
            "weight": "25 x2 lb",
            "rpe": 6,
            "restSeconds": 60
          },
          "notes": "Each leg, core stability with lower body integration"
        }
      ]
    },
    {
      "type": "Recovery",
      "title": "Mobility & Cooldown",
      "items": [
        {
          "kind": "exercise",
          "name": "Figure-4 Stretch",
          "link": "exercises/figure_4_stretch.json",
          "logType": "stretch",
          "prescription": {
            "sets": 2,
            "timeSeconds": 45
          },
          "notes": "Each side, glute and hip release"
        },
        {
          "kind": "exercise",
          "name": "Calf Stretch",
          "link": "exercises/calf_stretch.json",
          "logType": "stretch",
          "prescription": {
            "sets": 2,
            "timeSeconds": 45
          },
          "notes": "Each leg, address calf training"
        },
        {
          "kind": "exercise",
          "name": "Low Lunge Stretch",
          "link": "exercises/low_lunge_stretch.json",
          "logType": "stretch",
          "prescription": {
            "sets": 2,
            "timeSeconds": 45
          },
          "notes": "Each side, hip flexor release"
        },
        {
          "kind": "exercise",
          "name": "Deep Breathing",
          "link": "exercises/deep_breathing.json",
          "logType": "stretch",
          "prescription": {
            "sets": 1,
            "timeSeconds": 90
          },
          "notes": "Recovery and nervous system reset"
        }
      ]
    }
  ]
}